Forum	Url
Desktop Operating Systems And Recovery	https://h30434.www3.hp.com/t5/Desktop-Operating-Systems-and-Recovery/bd-p/OSandSW
Desktop Boot And Lockup	https://h30434.www3.hp.com/t5/Desktop-Boot-and-Lockup/bd-p/lockups
Desktop Wireless And Networking	https://h30434.www3.hp.com/t5/Desktop-Wireless-and-Networking/bd-p/DesktopWirelessNetworking
Desktop Audio	https://h30434.www3.hp.com/t5/Desktop-Audio/bd-p/Monitor
Desktop Video, Display And Touch	https://h30434.www3.hp.com/t5/Desktop-Video-Display-and-Touch/bd-p/TouchSmartPC
Desktop Hardware And Upgrade Questions	https://h30434.www3.hp.com/t5/Desktop-Hardware-and-Upgrade-Questions/bd-p/HardwareDPC
Desktop Software And How To Questions	https://h30434.www3.hp.com/t5/Desktop-Software-and-How-To-Questions/bd-p/DesktopQA
Sprout By HP	https://h30434.www3.hp.com/t5/Sprout-by-HP/bd-p/Sprout
Business PCs, Workstations And Point Of Sale Systems	https://h30434.www3.hp.com/t5/Business-PCs-Workstations-and-Point-of-Sale-Systems/bd-p/Business-PC-Workstation-POS